{
  "schema_version": "evidence/0.3",
  "doc": {
    "doc_id": "d44e95085",
    "file_id": "sha256:44e9508596f93a4a3107ca42012660b64c111f88ed8c887351fce7e21ea4338a",
    "file_name": "pledge.pdf",
    "file_sha256": "44e9508596f93a4a3107ca42012660b64c111f88ed8c887351fce7e21ea4338a",
    "file_size": 107365,
    "page_count": 2,
    "parsed_at": "2026-09-28T14:34:23+08:00",
    "parser": {
      "name": "finstruct.parse",
      "version": "0.3.0"
    },
    "coord_system": {
      "unit": "pdf_point",
      "unit_zh": "PDF 点（1 pt = 1/72 英寸）",
      "origin": "top_left",
      "origin_zh": "页面左上角，y 轴向下为正",
      "field": "region",
      "order": [
        "left",
        "top",
        "right",
        "bottom"
      ],
      "normalize_hint": "屏幕坐标 = region / [page.width, page.height] × 显示尺寸"
    }
  },
  "pages": [
    {
      "page": 1,
      "form": "TEXT",
      "width": 595.25,
      "height": 842.0,
      "form_evidence": {
        "text_chars": 880,
        "text_area_ratio": 0.2389,
        "image_area_ratio": 0.0,
        "ink_ratio": null,
        "rule": "R1_text_layer",
        "thresholds": {
          "text_chars_min": 80,
          "text_area_ratio_min": 0.02,
          "scanned_chars_max": 20,
          "image_area_ratio_min": 0.5,
          "watermark_image_area_ratio_min": 0.3,
          "ink_ratio_min": 0.01
        }
      },
      "blocks": [
        {
          "block_id": "d44e95085_p001_b00001",
          "doc_id": "d44e95085",
          "page": 1,
          "type": "TEXT",
          "source_type": "paragraph",
          "role": "BODY",
          "text": "证券代码：300552 证券简称：万集科技 公告编号：2026-046",
          "text_raw": "证券代码：300552证券简称：万集科技公告编号：2026-046",
          "region": [
            56.64,
            73.78,
            538.44,
            87.72
          ],
          "table_ref": null,
          "font_size": 12.0,
          "source": "TEXT_LAYER",
          "ocr_confidence": null,
          "degraded": false,
          "missing_reason": null
        },
        {
          "block_id": "d44e95085_p001_b00002",
          "doc_id": "d44e95085",
          "page": 1,
          "type": "TEXT",
          "source_type": "paragraph",
          "role": "TITLE",
          "text": "北京万集科技股份有限公司关于控股股东、实际控制人部分股份质押的公告本公司及董事会全体成员保证信息披露的内容真实、准确、完整，没有虚假记载、误导性陈述或重",
          "text_raw": "北京万集科技股份有限公司关于控股股东、实际控制人部分股份质押的公告本公司及董事会全体成员保证信息披露的内容真实、准确、完整，没有虚假记载、误导性陈述或重",
          "region": [
            77.64,
            129.65,
            529.07,
            200.99
          ],
          "table_ref": null,
          "font_size": 10.45,
          "source": "TEXT_LAYER",
          "ocr_confidence": null,
          "degraded": false,
          "missing_reason": null
        },
        {
          "block_id": "d44e95085_p001_b00003",
          "doc_id": "d44e95085",
          "page": 1,
          "type": "TEXT",
          "source_type": "paragraph",
          "role": "BODY",
          "text": "大遗漏。",
          "text_raw": "大遗漏。",
          "region": [
            56.64,
            210.46,
            98.53,
            220.91
          ],
          "table_ref": null,
          "font_size": 10.45,
          "source": "TEXT_LAYER",
          "ocr_confidence": null,
          "degraded": false,
          "missing_reason": null
        },
        {
          "block_id": "d44e95085_p001_b00004",
          "doc_id": "d44e95085",
          "page": 1,
          "type": "TEXT",
          "source_type": "paragraph",
          "role": "SECTION",
          "text": "一、股东股份质押基本情况",
          "text_raw": "一、股东股份质押基本情况",
          "region": [
            80.64,
            252.82,
            225.12,
            264.82
          ],
          "table_ref": null,
          "font_size": 12.0,
          "source": "TEXT_LAYER",
          "ocr_confidence": null,
          "degraded": false,
          "missing_reason": null
        },
        {
          "block_id": "d44e95085_p001_b00005",
          "doc_id": "d44e95085",
          "page": 1,
          "type": "TEXT",
          "source_type": "paragraph",
          "role": "BODY",
          "text": "股东及其一致行动人所持股份涉及以下哪种情形：",
          "text_raw": "股东及其一致行动人所持股份涉及以下哪种情形：",
          "region": [
            80.64,
            276.22,
            344.64,
            288.22
          ],
          "table_ref": null,
          "font_size": 12.0,
          "source": "TEXT_LAYER",
          "ocr_confidence": null,
          "degraded": false,
          "missing_reason": null
        },
        {
          "block_id": "d44e95085_p001_b00006",
          "doc_id": "d44e95085",
          "page": 1,
          "type": "TEXT",
          "source_type": "paragraph",
          "role": "BODY",
          "text": "股份质押□股份冻结□股份拍卖",
          "text_raw": "股份质押□股份冻结□股份拍卖",
          "region": [
            80.64,
            299.62,
            255.84,
            313.44
          ],
          "table_ref": null,
          "font_size": 12.0,
          "source": "TEXT_LAYER",
          "ocr_confidence": null,
          "degraded": false,
          "missing_reason": null
        },
        {
          "block_id": "d44e95085_p001_b00007",
          "doc_id": "d44e95085",
          "page": 1,
          "type": "TEXT",
          "source_type": "paragraph",
          "role": "TITLE",
          "text": "北京万集科技股份有限公司（以下简称“公司”）于近日接到公司控股股东、实际控制",
          "text_raw": "北京万集科技股份有限公司（以下简称“公司”）于近日接到公司控股股东、实际控制",
          "region": [
            80.64,
            323.02,
            523.32,
            336.84
          ],
          "table_ref": null,
          "font_size": 12.0,
          "source": "TEXT_LAYER",
          "ocr_confidence": null,
          "degraded": false,
          "missing_reason": null
        },
        {
          "block_id": "d44e95085_p001_b00008",
          "doc_id": "d44e95085",
          "page": 1,
          "type": "TEXT",
          "source_type": "paragraph",
          "role": "BODY",
          "text": "人翟军先生的通知，翟军先生将其持有的公司部分股份办理了质押业务，具体事项如下：",
          "text_raw": "人翟军先生的通知，翟军先生将其持有的公司部分股份办理了质押业务，具体事项如下：",
          "region": [
            56.64,
            346.42,
            524.64,
            358.42
          ],
          "table_ref": null,
          "font_size": 12.0,
          "source": "TEXT_LAYER",
          "ocr_confidence": null,
          "degraded": false,
          "missing_reason": null
        },
        {
          "block_id": "d44e95085_p001_b00009",
          "doc_id": "d44e95085",
          "page": 1,
          "type": "TEXT",
          "source_type": "paragraph",
          "role": "SECTION",
          "text": "（一）股东股份质押基本情况",
          "text_raw": "（一）股东股份质押基本情况",
          "region": [
            80.64,
            369.82,
            236.64,
            381.82
          ],
          "table_ref": null,
          "font_size": 12.0,
          "source": "TEXT_LAYER",
          "ocr_confidence": null,
          "degraded": false,
          "missing_reason": null
        },
        {
          "block_id": "d44e95085_p001_b00010",
          "doc_id": "d44e95085",
          "page": 1,
          "type": "TEXT",
          "source_type": "paragraph",
          "role": "BODY",
          "text": "1．本次股份质押基本情况",
          "text_raw": "1．本次股份质押基本情况",
          "region": [
            80.64,
            393.22,
            218.64,
            407.04
          ],
          "table_ref": null,
          "font_size": 12.0,
          "source": "TEXT_LAYER",
          "ocr_confidence": null,
          "degraded": false,
          "missing_reason": null
        },
        {
          "block_id": "d44e95085_p001_b00011",
          "doc_id": "d44e95085",
          "page": 1,
          "type": "TEXT",
          "source_type": "cell",
          "role": "BODY",
          "text": "质押到期日",
          "text_raw": "质押到期日",
          "region": [
            423.95,
            410.92,
            466.25,
            469.52
          ],
          "table_ref": {
            "table_id": "d44e95085_p001_t001",
            "cell_id": "c039",
            "row": 0,
            "col": 7
          },
          "font_size": null,
          "source": "TEXT_LAYER",
          "ocr_confidence": null,
          "degraded": false,
          "missing_reason": null
        },
        {
          "block_id": "d44e95085_p001_b00012",
          "doc_id": "d44e95085",
          "page": 1,
          "type": "TEXT",
          "source_type": "cell",
          "role": "BODY",
          "text": "质权人",
          "text_raw": "质权人",
          "region": [
            466.25,
            410.92,
            519.85,
            469.52
          ],
          "table_ref": {
            "table_id": "d44e95085_p001_t001",
            "cell_id": "c044",
            "row": 0,
            "col": 8
          },
          "font_size": null,
          "source": "TEXT_LAYER",
          "ocr_confidence": null,
          "degraded": false,
          "missing_reason": null
        },
        {
          "block_id": "d44e95085_p001_b00013",
          "doc_id": "d44e95085",
          "page": 1,
          "type": "TEXT",
          "source_type": "cell",
          "role": "BODY",
          "text": "质押用途",
          "text_raw": "质押用途",
          "region": [
            519.85,
            410.92,
            558.08,
            469.52
          ],
          "table_ref": {
            "table_id": "d44e95085_p001_t001",
            "cell_id": "c049",
            "row": 0,
            "col": 9
          },
          "font_size": null,
          "source": "TEXT_LAYER",
          "ocr_confidence": null,
          "degraded": false,
          "missing_reason": null
        },
        {
          "block_id": "d44e95085_p001_b00014",
          "doc_id": "d44e95085",
          "page": 1,
          "type": "TEXT",
          "source_type": "table",
          "role": "BODY",
          "text": "是否为控 是否为限是否股股东或 占其所持 占公司总 售股（如股东名 本次质押数 为补第一大股 股份比例 股本比例 是，注明 质押起始日称 量（股） 充质东及其一 （%） （%） 限售类押致行动人 型）",